{
  "$schema": "https://json-schema.org/draft/2020-12/schema",
  "$id": "https://hiveton.dev/schemas/lvgl-online-editor/project-doc.schema.json",
  "title": "ProjectDoc",
  "type": "object",
  "required": [
    "schemaVersion",
    "id",
    "name",
    "target",
    "theme",
    "screens",
    "assets",
    "styles",
    "events",
    "updatedAt"
  ],
  "additionalProperties": false,
  "properties": {
    "schemaVersion": {
      "const": 1
    },
    "id": {
      "type": "string",
      "minLength": 1
    },
    "name": {
      "type": "string",
      "minLength": 1
    },
    "target": {
      "$ref": "#/$defs/TargetConfig"
    },
    "theme": {
      "enum": [
        "dark",
        "light"
      ]
    },
    "screens": {
      "type": "array",
      "minItems": 1,
      "items": {
        "$ref": "#/$defs/ScreenNode"
      }
    },
    "assets": {
      "type": "array",
      "items": {
        "$ref": "#/$defs/AssetRef"
      }
    },
    "styles": {
      "type": "array",
      "items": {
        "$ref": "#/$defs/StyleDef"
      }
    },
    "events": {
      "type": "array",
      "items": {
        "$ref": "#/$defs/EventBinding"
      }
    },
    "updatedAt": {
      "type": "string",
      "minLength": 1
    }
  },
  "$defs": {
    "TargetConfig": {
      "type": "object",
      "required": [
        "lvglVersion",
        "deviceName",
        "width",
        "height",
        "dpi",
        "colorDepth"
      ],
      "additionalProperties": false,
      "properties": {
        "lvglVersion": {
          "const": "8.3"
        },
        "deviceName": {
          "type": "string",
          "minLength": 1
        },
        "width": {
          "type": "number",
          "exclusiveMinimum": 0
        },
        "height": {
          "type": "number",
          "exclusiveMinimum": 0
        },
        "dpi": {
          "type": "number",
          "exclusiveMinimum": 0
        },
        "colorDepth": {
          "enum": [
            16,
            32
          ]
        }
      }
    },
    "LayoutBox": {
      "type": "object",
      "required": [
        "x",
        "y",
        "width",
        "height"
      ],
      "additionalProperties": false,
      "properties": {
        "x": {
          "type": "number"
        },
        "y": {
          "type": "number"
        },
        "width": {
          "type": "number",
          "exclusiveMinimum": 0
        },
        "height": {
          "type": "number",
          "exclusiveMinimum": 0
        },
        "align": {
          "enum": [
            "top-left",
            "top-right",
            "center",
            "bottom-left",
            "bottom-right"
          ]
        },
        "flex": {
          "$ref": "#/$defs/FlexLayout"
        }
      }
    },
    "FlexLayout": {
      "type": "object",
      "required": [
        "direction",
        "gap",
        "wrap"
      ],
      "additionalProperties": false,
      "properties": {
        "direction": {
          "enum": [
            "row",
            "column"
          ]
        },
        "gap": {
          "type": "number",
          "minimum": 0
        },
        "wrap": {
          "type": "boolean"
        }
      }
    },
    "WidgetStyle": {
      "type": "object",
      "additionalProperties": false,
      "properties": {
        "opacity": {
          "type": "number",
          "minimum": 0,
          "maximum": 100
        },
        "bgColor": {
          "type": "string"
        },
        "textColor": {
          "type": "string"
        },
        "borderColor": {
          "type": "string"
        },
        "radius": {
          "type": "number",
          "minimum": 0
        },
        "padding": {
          "$ref": "#/$defs/PaddingBox"
        },
        "font": {
          "type": "string"
        },
        "lineSpace": {
          "type": "number"
        },
        "letterSpace": {
          "type": "number"
        },
        "align": {
          "enum": [
            "left",
            "center",
            "right"
          ]
        }
      }
    },
    "PaddingBox": {
      "type": "object",
      "required": [
        "top",
        "right",
        "bottom",
        "left"
      ],
      "additionalProperties": false,
      "properties": {
        "top": {
          "type": "number",
          "minimum": 0
        },
        "right": {
          "type": "number",
          "minimum": 0
        },
        "bottom": {
          "type": "number",
          "minimum": 0
        },
        "left": {
          "type": "number",
          "minimum": 0
        }
      }
    },
    "WidgetNode": {
      "type": "object",
      "required": [
        "id",
        "type",
        "name",
        "parentId",
        "children",
        "layout",
        "props",
        "style",
        "locked",
        "hidden"
      ],
      "additionalProperties": false,
      "properties": {
        "id": {
          "type": "string",
          "minLength": 1
        },
        "type": {
          "enum": [
            "screen",
            "container",
            "button",
            "label",
            "image",
            "arc",
            "bar",
            "line",
            "switch",
            "slider",
            "checkbox",
            "dropdown",
            "spinner",
            "chart"
          ]
        },
        "name": {
          "type": "string",
          "minLength": 1
        },
        "parentId": {
          "type": [
            "string",
            "null"
          ]
        },
        "children": {
          "type": "array",
          "items": {
            "$ref": "#/$defs/WidgetNode"
          }
        },
        "layout": {
          "$ref": "#/$defs/LayoutBox"
        },
        "props": {
          "type": "object",
          "additionalProperties": {
            "anyOf": [
              {
                "type": "string"
              },
              {
                "type": "number"
              },
              {
                "type": "boolean"
              },
              {
                "type": "array",
                "items": {
                  "type": "number"
                }
              }
            ]
          }
        },
        "style": {
          "$ref": "#/$defs/WidgetStyle"
        },
        "locked": {
          "type": "boolean"
        },
        "hidden": {
          "type": "boolean"
        }
      }
    },
    "ScreenNode": {
      "type": "object",
      "required": [
        "id",
        "name",
        "root"
      ],
      "additionalProperties": false,
      "properties": {
        "id": {
          "type": "string",
          "minLength": 1
        },
        "name": {
          "type": "string",
          "minLength": 1
        },
        "root": {
          "$ref": "#/$defs/WidgetNode"
        }
      }
    },
    "AssetRef": {
      "type": "object",
      "required": [
        "id",
        "projectId",
        "name",
        "kind",
        "mimeType",
        "sizeBytes",
        "objectKey",
        "createdAt"
      ],
      "additionalProperties": false,
      "properties": {
        "id": {
          "type": "string",
          "minLength": 1
        },
        "projectId": {
          "type": "string",
          "minLength": 1
        },
        "name": {
          "type": "string",
          "minLength": 1
        },
        "kind": {
          "enum": [
            "image",
            "font"
          ]
        },
        "mimeType": {
          "type": "string",
          "minLength": 1
        },
        "width": {
          "type": "number",
          "minimum": 0
        },
        "height": {
          "type": "number",
          "minimum": 0
        },
        "sizeBytes": {
          "type": "number",
          "minimum": 0
        },
        "objectKey": {
          "type": "string",
          "minLength": 1
        },
        "createdAt": {
          "type": "string",
          "minLength": 1
        }
      }
    },
    "StyleDef": {
      "type": "object",
      "required": [
        "id",
        "name",
        "style"
      ],
      "additionalProperties": false,
      "properties": {
        "id": {
          "type": "string",
          "minLength": 1
        },
        "name": {
          "type": "string",
          "minLength": 1
        },
        "style": {
          "$ref": "#/$defs/WidgetStyle"
        }
      }
    },
    "EventBinding": {
      "type": "object",
      "required": [
        "id",
        "widgetId",
        "event",
        "handlerName"
      ],
      "additionalProperties": false,
      "properties": {
        "id": {
          "type": "string",
          "minLength": 1
        },
        "widgetId": {
          "type": "string",
          "minLength": 1
        },
        "event": {
          "enum": [
            "LV_EVENT_CLICKED",
            "LV_EVENT_VALUE_CHANGED",
            "LV_EVENT_READY",
            "LV_EVENT_CANCEL"
          ]
        },
        "handlerName": {
          "type": "string",
          "minLength": 1
        }
      }
    }
  }
}
